Type,SKU,Name,Published,Is featured?,Visibility in catalog,Short description,Description,Sale price,Regular price,Categories,Tags,Tax status,In stock?,Stock,Backorders allowed?,Weight (kg),Length (cm),Width (cm),Height (cm),Images
simple,FT-SRM-001,Green Tea Brightening Serum,1,1,visible,"Antioxidant-rich serum with matcha extract that visibly brightens and evens skin tone in as little as 2 weeks.","<h3>Unlock your natural glow with the power of green tea.</h3><p>Our best-selling Green Tea Brightening Serum is packed with concentrated matcha extract and vitamin C to target dullness, dark spots, and uneven skin tone. The lightweight, fast-absorbing formula layers effortlessly under moisturiser and makeup.</p><h4>Key Ingredients</h4><ul><li><strong>Matcha Extract</strong> — loaded with EGCG antioxidants to fight free radical damage</li><li><strong>Vitamin C (Ascorbic Acid)</strong> — brightens dark spots and boosts collagen production</li><li><strong>Hyaluronic Acid</strong> — locks in moisture for plump, dewy skin</li><li><strong>Niacinamide</strong> — minimises pores and smooths texture</li></ul><h4>How to Use</h4><ol><li>Cleanse and tone your face</li><li>Apply 3–4 drops to fingertips</li><li>Gently press into face and neck, avoiding the eye area</li><li>Follow with moisturiser</li><li>Use morning and night for best results</li></ol><p><strong>Best For:</strong> All skin types, especially dull or uneven complexions<br><strong>Size:</strong> 30 ml / 1 fl oz<br>Cruelty-Free | Vegan | Paraben-Free</p>",24.99,34.99,Serums,"green tea, brightening, serum, matcha, vitamin c, anti-aging",taxable,1,100,,0.15,12,4,4,
simple,FT-CLN-002,Chamomile Calming Face Wash,1,0,visible,"Gentle foam cleanser with chamomile and calendula that soothes redness and removes impurities without stripping moisture.","<h3>The gentlest clean your skin has ever felt.</h3><p>FaceTea's Chamomile Calming Face Wash transforms into a silky foam that lifts away dirt, oil, and makeup while calming irritated skin. Infused with real chamomile flower extract and calendula oil, it leaves your face feeling soft, balanced, and never tight.</p><h4>Key Ingredients</h4><ul><li><strong>Chamomile Flower Extract</strong> — anti-inflammatory properties calm redness and irritation</li><li><strong>Calendula Oil</strong> — promotes healing and soothes sensitive skin</li><li><strong>Aloe Vera</strong> — hydrates and provides a protective moisture barrier</li><li><strong>Glycerin</strong> — draws water into the skin to prevent dryness after cleansing</li></ul><h4>How to Use</h4><ol><li>Wet your face with lukewarm water</li><li>Pump a small amount into your palms and lather</li><li>Massage gently in circular motions for 30–60 seconds</li><li>Rinse thoroughly and pat dry</li><li>Follow with toner and moisturiser</li></ol><p><strong>Best For:</strong> Sensitive, dry, and irritation-prone skin<br><strong>Size:</strong> 150 ml / 5 fl oz<br>Cruelty-Free | Vegan | Sulfate-Free</p>",14.99,14.99,Cleansers,"chamomile, face wash, cleanser, sensitive skin, calendula",taxable,1,100,,0.25,15,5,5,
simple,FT-TRT-003,White Tea Eye Cream,1,0,visible,"Delicate eye cream with white tea peptides that reduces dark circles and fine lines while you sleep.","<h3>Wake up to brighter, younger-looking eyes.</h3><p>The most delicate area of your face deserves the most refined ingredient. White tea — the least processed of all teas — delivers a potent dose of antioxidants and peptides to the under-eye area. Our White Tea Eye Cream visibly reduces dark circles, puffiness, and crow's feet with consistent use.</p><h4>Key Ingredients</h4><ul><li><strong>White Tea Extract</strong> — premium antioxidant protection with anti-ageing properties</li><li><strong>Peptide Complex</strong> — stimulates collagen to smooth fine lines</li><li><strong>Caffeine</strong> — reduces puffiness by constricting blood vessels</li><li><strong>Squalane</strong> — deeply moisturises without clogging pores</li></ul><h4>How to Use</h4><ol><li>After cleansing and applying serum, take a pea-sized amount</li><li>Dot gently around the orbital bone using your ring finger</li><li>Pat softly — never rub or pull the delicate eye area</li><li>Use every evening before bed for best results</li><li>Can also be applied in the morning under concealer</li></ol><p><strong>Best For:</strong> All skin types; especially for dark circles, puffiness, and fine lines<br><strong>Size:</strong> 15 ml / 0.5 fl oz<br>Cruelty-Free | Vegan | Fragrance-Free</p>",34.99,44.99,Treatments,"white tea, eye cream, dark circles, anti-aging, peptides",taxable,1,100,,0.10,8,3,3,
simple,FT-MST-004,Oolong Hydrating Day Cream,1,0,visible,"Lightweight SPF 30 moisturiser with oolong polyphenols that hydrates and shields your skin all day long.","<h3>All-day hydration meets sun protection — in one step.</h3><p>Skip the multi-step routine. Our Oolong Hydrating Day Cream combines rich oolong tea polyphenols with broad-spectrum SPF 30 in a lightweight, non-greasy formula. It absorbs in seconds, sits beautifully under makeup, and keeps your skin hydrated from morning to evening.</p><h4>Key Ingredients</h4><ul><li><strong>Oolong Tea Polyphenols</strong> — powerful antioxidants that protect against environmental stress</li><li><strong>Zinc Oxide (SPF 30)</strong> — mineral broad-spectrum UV protection</li><li><strong>Ceramides</strong> — strengthen the skin barrier and lock in moisture</li><li><strong>Vitamin E</strong> — nourishes and repairs sun-stressed skin</li></ul><h4>How to Use</h4><ol><li>Apply as the last step of your morning skincare routine</li><li>Use a nickel-sized amount for face and neck</li><li>Smooth evenly and let absorb for 1–2 minutes before makeup</li><li>Reapply every 2 hours if in direct sunlight</li><li>Pair with the Green Tea Brightening Serum for maximum glow</li></ol><p><strong>Best For:</strong> All skin types; ideal for daily wear<br><strong>Size:</strong> 50 ml / 1.7 fl oz<br>Cruelty-Free | Vegan | Reef-Safe SPF</p>",,29.99,Moisturisers,"oolong, moisturiser, spf, day cream, sun protection",taxable,1,100,,0.20,10,5,5,
simple,FT-TNR-005,Black Tea Firming Toner,1,0,visible,"Alcohol-free toner with black tea EGCG that tightens pores and improves skin elasticity after every use.","<h3>Tighten, tone, and prep — the step your routine is missing.</h3><p>Our Black Tea Firming Toner bridges the gap between cleansing and treatment. Rich in EGCG (the catechin found in fermented black tea), it visibly tightens pores, improves elasticity, and preps your skin to absorb serums and moisturisers more effectively.</p><h4>Key Ingredients</h4><ul><li><strong>Black Tea EGCG</strong> — tightens pores and boosts elasticity with powerful polyphenols</li><li><strong>Witch Hazel</strong> — natural astringent that balances oil production</li><li><strong>Rose Water</strong> — soothes and tones while adding a subtle freshness</li><li><strong>Panthenol (Vitamin B5)</strong> — calms skin and supports barrier repair</li></ul><h4>How to Use</h4><ol><li>After cleansing, pour a small amount onto a cotton pad or your palms</li><li>Sweep gently across face and neck</li><li>Allow to absorb for 30 seconds</li><li>Follow immediately with serum and moisturiser</li><li>Use morning and night</li></ol><p><strong>Best For:</strong> Oily, combination, and mature skin types<br><strong>Size:</strong> 200 ml / 6.8 fl oz<br>Cruelty-Free | Vegan | Alcohol-Free</p>",19.99,27.99,Toners,"black tea, toner, firming, pores, EGCG",taxable,1,100,,0.30,15,5,5,
simple,FT-MSK-006,Matcha Detox Clay Mask,1,0,visible,"Deep-cleansing clay mask with ceremonial matcha and kaolin clay that draws out impurities in just 10 minutes.","<h3>A 10-minute detox your skin will thank you for.</h3><p>Powered by ceremonial-grade matcha and French kaolin clay, this mask pulls out pore-clogging impurities, excess oil, and environmental pollutants without over-drying. Your skin is left feeling clean, smooth, and refreshed — never stripped or tight.</p><h4>Key Ingredients</h4><ul><li><strong>Ceremonial Matcha</strong> — 137x more antioxidants than regular green tea; detoxifies and brightens</li><li><strong>Kaolin Clay</strong> — gently absorbs excess oil without irritating sensitive skin</li><li><strong>Tea Tree Oil</strong> — antibacterial properties help prevent breakouts</li><li><strong>Aloe Vera</strong> — soothes and rehydrates skin post-mask</li></ul><h4>How to Use</h4><ol><li>Apply an even layer to clean, dry skin (avoid eyes and lips)</li><li>Leave on for 10 minutes — you'll feel a gentle tightening</li><li>Rinse off with warm water using circular motions</li><li>Pat dry and follow with toner and moisturiser</li><li>Use 1–2 times per week</li></ol><p><strong>Best For:</strong> Oily, combination, and acne-prone skin<br><strong>Size:</strong> 100 ml / 3.4 fl oz<br>Cruelty-Free | Vegan | No Artificial Fragrance</p>",22.99,22.99,Masks,"matcha, clay mask, detox, pores, kaolin",taxable,1,100,,0.25,10,8,8,
simple,FT-TRT-007,Rooibos Repair Night Oil,1,0,visible,"Nourishing facial oil with rooibos and rosehip that repairs and regenerates your skin while you sleep.","<h3>Let your skin repair itself — while you rest.</h3><p>South African rooibos tea is one of nature's best-kept skincare secrets. Rich in alpha hydroxy acid, zinc, and superoxide dismutase (SOD), our Rooibos Repair Night Oil works overnight to repair daily damage, reduce redness, and boost cell turnover. Wake up to softer, more radiant skin.</p><h4>Key Ingredients</h4><ul><li><strong>Rooibos Extract</strong> — rare antioxidant (SOD) that fights ageing and reduces inflammation</li><li><strong>Rosehip Seed Oil</strong> — rich in vitamins A and C; promotes cell regeneration</li><li><strong>Jojoba Oil</strong> — mimics natural sebum for balanced, non-greasy moisture</li><li><strong>Lavender Essential Oil</strong> — calms skin and promotes relaxation before sleep</li></ul><h4>How to Use</h4><ol><li>Apply as the final step of your evening routine</li><li>Warm 4–5 drops between your palms</li><li>Press gently into face and neck — let the oil sink in</li><li>Can be mixed with your night cream for extra hydration</li><li>Use nightly for best results</li></ol><p><strong>Best For:</strong> Dry, mature, and damaged skin<br><strong>Size:</strong> 30 ml / 1 fl oz<br>Cruelty-Free | Vegan | 100% Natural Oils</p>",,39.99,Treatments,"rooibos, night oil, repair, rosehip, anti-aging",taxable,1,100,,0.15,12,4,4,
simple,FT-EXF-008,Hibiscus AHA Exfoliating Pads,1,1,visible,"Pre-soaked exfoliating pads with hibiscus-derived AHAs that smooth texture and boost radiance in one swipe.","<h3>Smoother, brighter skin — one pad at a time.</h3><p>These convenient pre-soaked pads deliver a precise dose of hibiscus-derived alpha hydroxy acids (AHAs) with every use. The textured side gently buffs away dead skin cells while the smooth side deposits brightening and hydrating actives. No rinsing required.</p><h4>Key Ingredients</h4><ul><li><strong>Hibiscus AHAs</strong> — natural fruit acids that dissolve dead skin cells and stimulate renewal</li><li><strong>Lactic Acid</strong> — mild exfoliant that hydrates while it resurfaces</li><li><strong>Centella Asiatica (Cica)</strong> — calms post-exfoliation sensitivity</li><li><strong>Green Tea Extract</strong> — antioxidant boost to protect freshly revealed skin</li></ul><h4>How to Use</h4><ol><li>After cleansing, take one pad from the jar</li><li>Swipe the textured side across face and neck (avoid eyes)</li><li>Flip to the smooth side and press gently to deposit actives</li><li>Let absorb — no rinsing needed</li><li>Follow with serum and moisturiser. Use 2–3 times per week.</li></ol><p><strong>Best For:</strong> All skin types; especially dull, rough, or congested skin<br><strong>Size:</strong> 50 pads per jar<br>Cruelty-Free | Vegan | Dermatologist-Tested</p>",27.99,35.99,Exfoliants,"hibiscus, AHA, exfoliating pads, brightening, texture",taxable,1,100,,0.20,10,10,8,
